[
  {
    "id": "mcq-big-o-001",
    "prompt": "What is the time complexity of scanning every element of an array once?",
    "choices": [
      "O(1)",
      "O(log n)",
      "O(n)",
      "O(n log n)"
    ],
    "answerIndex": 2,
    "tags": [
      "big-o",
      "complexity",
      "arrays"
    ],
    "difficulty": 1,
    "source": "dorso-inhouse"
  },
  {
    "id": "mcq-big-o-002",
    "prompt": "What is the time complexity of binary search on a sorted array?",
    "choices": [
      "O(1)",
      "O(log n)",
      "O(n)",
      "O(n^2)"
    ],
    "answerIndex": 1,
    "tags": [
      "big-o",
      "complexity",
      "search"
    ],
    "difficulty": 1,
    "source": "dorso-inhouse"
  },
  {
    "id": "mcq-big-o-003",
    "prompt": "What is the usual time complexity of comparing every pair in an n-item list?",
    "choices": [
      "O(n)",
      "O(log n)",
      "O(n^2)",
      "O(2^n)"
    ],
    "answerIndex": 2,
    "tags": [
      "big-o",
      "complexity",
      "loops"
    ],
    "difficulty": 1,
    "source": "dorso-inhouse"
  },
  {
    "id": "mcq-big-o-004",
    "prompt": "If an algorithm does two separate full passes over n items, what is the asymptotic time?",
    "choices": [
      "O(1)",
      "O(n)",
      "O(n^2)",
      "O(log n)"
    ],
    "answerIndex": 1,
    "tags": [
      "big-o",
      "complexity",
      "arrays"
    ],
    "difficulty": 1,
    "source": "dorso-inhouse"
  },
  {
    "id": "mcq-big-o-005",
    "prompt": "Which term dominates n^2 + n log n + 50 for large n?",
    "choices": [
      "50",
      "n log n",
      "n^2",
      "n"
    ],
    "answerIndex": 2,
    "tags": [
      "big-o",
      "complexity",
      "dominance"
    ],
    "difficulty": 2,
    "source": "dorso-inhouse"
  },
  {
    "id": "mcq-big-o-006",
    "prompt": "What is the extra space complexity of sorting an array in place with heap sort?",
    "choices": [
      "O(1)",
      "O(log n)",
      "O(n)",
      "O(n^2)"
    ],
    "answerIndex": 0,
    "tags": [
      "big-o",
      "complexity",
      "sorting"
    ],
    "difficulty": 2,
    "source": "dorso-inhouse"
  },
  {
    "id": "mcq-big-o-007",
    "prompt": "What is the average time complexity of lookup in a well-sized hash table?",
    "choices": [
      "O(1)",
      "O(log n)",
      "O(n)",
      "O(n log n)"
    ],
    "answerIndex": 0,
    "tags": [
      "big-o",
      "complexity",
      "hash-table"
    ],
    "difficulty": 1,
    "source": "dorso-inhouse"
  },
  {
    "id": "mcq-big-o-008",
    "prompt": "What is the worst-case lookup time in a hash table when all keys collide?",
    "choices": [
      "O(1)",
      "O(log n)",
      "O(n)",
      "O(n^2)"
    ],
    "answerIndex": 2,
    "tags": [
      "big-o",
      "complexity",
      "hash-table"
    ],
    "difficulty": 2,
    "source": "dorso-inhouse"
  },
  {
    "id": "mcq-big-o-009",
    "prompt": "Which growth rate is smallest for large n?",
    "choices": [
      "O(n)",
      "O(log n)",
      "O(n log n)",
      "O(n^2)"
    ],
    "answerIndex": 1,
    "tags": [
      "big-o",
      "complexity",
      "growth"
    ],
    "difficulty": 1,
    "source": "dorso-inhouse"
  },
  {
    "id": "mcq-big-o-010",
    "prompt": "Which growth rate is largest for large n?",
    "choices": [
      "O(n log n)",
      "O(n^2)",
      "O(2^n)",
      "O(n^3)"
    ],
    "answerIndex": 2,
    "tags": [
      "big-o",
      "complexity",
      "growth"
    ],
    "difficulty": 2,
    "source": "dorso-inhouse"
  },
  {
    "id": "mcq-big-o-011",
    "prompt": "A loop halves n on each iteration. What is its time complexity?",
    "choices": [
      "O(1)",
      "O(log n)",
      "O(n)",
      "O(n^2)"
    ],
    "answerIndex": 1,
    "tags": [
      "big-o",
      "complexity",
      "loops"
    ],
    "difficulty": 1,
    "source": "dorso-inhouse"
  },
  {
    "id": "mcq-big-o-012",
    "prompt": "A nested loop runs n times outside and log n times inside. What is the time complexity?",
    "choices": [
      "O(n)",
      "O(log n)",
      "O(n log n)",
      "O(n^2)"
    ],
    "answerIndex": 2,
    "tags": [
      "big-o",
      "complexity",
      "loops"
    ],
    "difficulty": 2,
    "source": "dorso-inhouse"
  },
  {
    "id": "mcq-big-o-013",
    "prompt": "What does amortized O(1) push on a dynamic array mean?",
    "choices": [
      "Every push costs exactly one operation",
      "The average cost over many pushes is constant",
      "The worst push is constant",
      "Memory use is constant"
    ],
    "answerIndex": 1,
    "tags": [
      "big-o",
      "complexity",
      "arrays"
    ],
    "difficulty": 3,
    "source": "dorso-inhouse"
  },
  {
    "id": "mcq-big-o-014",
    "prompt": "Which operation is O(n) for a contiguous dynamic array?",
    "choices": [
      "Read by index",
      "Append when capacity remains",
      "Insert at the front",
      "Read length"
    ],
    "answerIndex": 2,
    "tags": [
      "big-o",
      "complexity",
      "arrays"
    ],
    "difficulty": 1,
    "source": "dorso-inhouse"
  },
  {
    "id": "mcq-big-o-015",
    "prompt": "What is the time complexity of merge sort in the usual comparison model?",
    "choices": [
      "O(n)",
      "O(n log n)",
      "O(n^2)",
      "O(log n)"
    ],
    "answerIndex": 1,
    "tags": [
      "big-o",
      "complexity",
      "sorting"
    ],
    "difficulty": 1,
    "source": "dorso-inhouse"
  },
  {
    "id": "mcq-big-o-016",
    "prompt": "What is the best-case time complexity of quicksort with balanced partitions?",
    "choices": [
      "O(n)",
      "O(n log n)",
      "O(n^2)",
      "O(log n)"
    ],
    "answerIndex": 1,
    "tags": [
      "big-o",
      "complexity",
      "sorting"
    ],
    "difficulty": 2,
    "source": "dorso-inhouse"
  },
  {
    "id": "mcq-big-o-017",
    "prompt": "What is the worst-case time complexity of quicksort with consistently terrible pivots?",
    "choices": [
      "O(n log n)",
      "O(n)",
      "O(n^2)",
      "O(log n)"
    ],
    "answerIndex": 2,
    "tags": [
      "big-o",
      "complexity",
      "sorting"
    ],
    "difficulty": 2,
    "source": "dorso-inhouse"
  },
  {
    "id": "mcq-big-o-018",
    "prompt": "Which algorithmic pattern often produces O(2^n) time?",
    "choices": [
      "Single pass",
      "Balanced tree search",
      "Trying all subsets",
      "Hash lookup"
    ],
    "answerIndex": 2,
    "tags": [
      "big-o",
      "complexity",
      "recursion"
    ],
    "difficulty": 2,
    "source": "dorso-inhouse"
  },
  {
    "id": "mcq-big-o-019",
    "prompt": "Why are constant factors usually dropped in Big-O notation?",
    "choices": [
      "They never affect runtime",
      "Big-O describes growth rate as n becomes large",
      "They are impossible to measure",
      "They only apply to memory"
    ],
    "answerIndex": 1,
    "tags": [
      "big-o",
      "complexity",
      "analysis"
    ],
    "difficulty": 1,
    "source": "dorso-inhouse"
  },
  {
    "id": "mcq-big-o-020",
    "prompt": "Which statement is true about O(n) and O(2n)?",
    "choices": [
      "O(2n) is a different asymptotic class",
      "Both are O(n)",
      "O(n) always runs twice as fast",
      "Neither is linear"
    ],
    "answerIndex": 1,
    "tags": [
      "big-o",
      "complexity",
      "analysis"
    ],
    "difficulty": 1,
    "source": "dorso-inhouse"
  },
  {
    "id": "mcq-data-structures-001",
    "prompt": "What does a dynamic array usually store to make append efficient?",
    "choices": [
      "A sorted index only",
      "Capacity larger than current length",
      "A pointer per element",
      "A hash per slot"
    ],
    "answerIndex": 1,
    "tags": [
      "data-structures",
      "arrays",
      "internals"
    ],
    "difficulty": 2,
    "source": "dorso-inhouse"
  },
  {
    "id": "mcq-data-structures-002",
    "prompt": "What problem does separate chaining solve in a hash table?",
    "choices": [
      "Recursive calls",
      "Hash collisions",
      "Stack overflow",
      "Disk fragmentation"
    ],
    "answerIndex": 1,
    "tags": [
      "data-structures",
      "hash-table",
      "internals"
    ],
    "difficulty": 1,
    "source": "dorso-inhouse"
  },
  {
    "id": "mcq-data-structures-003",
    "prompt": "In open addressing, where are collided hash-table keys stored?",
    "choices": [
      "In linked lists outside the table",
      "In other slots of the same table",
      "Only on disk",
      "In a balanced tree always"
    ],
    "answerIndex": 1,
    "tags": [
      "data-structures",
      "hash-table",
      "internals"
    ],
    "difficulty": 2,
    "source": "dorso-inhouse"
  },
  {
    "id": "mcq-data-structures-004",
    "prompt": "Why do hash tables resize?",
    "choices": [
      "To keep load factor within a useful range",
      "To sort keys",
      "To remove all nulls",
      "To make keys immutable"
    ],
    "answerIndex": 0,
    "tags": [
      "data-structures",
      "hash-table",
      "internals"
    ],
    "difficulty": 2,
    "source": "dorso-inhouse"
  },
  {
    "id": "mcq-data-structures-005",
    "prompt": "What is the core invariant of a min-heap?",
    "choices": [
      "Every parent is <= its children",
      "Every parent is >= its children",
      "The array is globally sorted",
      "Leaves must be equal"
    ],
    "answerIndex": 0,
    "tags": [
      "data-structures",
      "heap",
      "internals"
    ],
    "difficulty": 1,
    "source": "dorso-inhouse"
  },
  {
    "id": "mcq-data-structures-006",
    "prompt": "How is a binary heap commonly represented?",
    "choices": [
      "As a linked list only",
      "As an array with index arithmetic",
      "As a hash map",
      "As a stack frame chain"
    ],
    "answerIndex": 1,
    "tags": [
      "data-structures",
      "heap",
      "arrays"
    ],
    "difficulty": 1,
    "source": "dorso-inhouse"
  },
  {
    "id": "mcq-data-structures-007",